"","pmid","X","publication_year","last_author","is_open_data","open_data_category","is_open_code","open_data_statements","open_code_statements","coi_text","is_coi_pred","fund_text","is_fund_pred","register_text","is_register_pred"
"305",32429814,125,2020,1,TRUE,"general-purpose repository, data availability statement",FALSE,"pmc7287361 pmc7287361 7287361 32429814 32429814 10 1098/rspb 2019 2779 rspb20192779 1001 14 42 133 neuroscience and cognition research article physiological synchrony predicts observational threat learning in humans synchrony observational threat learning e-mail: philip parnamets@ki se electronic supplementary material is available online at https://doi org/10 6084/m9 figshare c 4971161 27 5 2020 20 5 2020 20 5 2020 [ comment ] 287 1927 20192779 15 12 2019 24 4 2020 (c) 2020 the authors2020 http://creativecommons org/licenses/by/4 0/ http://creativecommons org/licenses/by/4 0/ published by the royal society under the terms of the creative commons attribution license http://creativecommons org/licenses/by/4 0/ which permits unrestricted use provided the original author and source are credited [ pi ] understanding how information about threats in the environment is shared and transmitted between individuals is crucial for explaining adaptive survival-related behaviour in humans and other animals and for developing treatments for phobias and other anxiety disorders.;     data accessibility data code and materials are available on the open science framework ( https://osf io/mkv8c ).     data accessibility data code and materials are available on the open science framework","","Competing interests We declare we have no competing interest.",TRUE,"Funding This research was supported by the Knut and Alice Wallenberg Foundation (KAW 495 2014.0237), a Consolidator Grant (2018-00877) from the Swedish Research Council (Vetenskapsrådet), and a Starting Grant (284366) from the European Research Council to Andreas Olsson.",TRUE,"",FALSE
"306",32429939,126,2020,0,TRUE,"general-purpose repository",FALSE,"scripts for data preparation and statistical analyses as well as detailed results from the random forest and regression analyses are available on the open science framework ( https://osf io/fu5sj/ ).;     the scripts used for statistical analyses and additional materials are publicly available at ( https://osf io/fu5sj/ ).","","Competing interests DMC reports personal fees from Elsevier and personal fees from UpToDate, Inc., outside the submitted work. The other authors declare no potential conflicts of interest.",TRUE,"Funding OF was supported by Karolinska Institutet (Clinical Scientist Training Programme) and received funding from Thuringstiftelsen (no. 2018–00390) during the conduct of the study. Funding sponsors did not influence the design, collection, analysis, or interpretation of data, writing the manuscript, or the decision to submit the manuscript for publication. Open access funding provided by Karolinska Institute.",TRUE,"Trial registration ClinicalTrials.gov ID: NCT02010619.",TRUE
"307",32457153,116,2020,0,TRUE,"general-purpose repository, data availability statement",FALSE,"the data that support the findings of this study are available at https://figshare com/articles/other_people_s_gaze_encoded_as_implied_motion_in_the_human_brain/12184848/1 ( ).;     data deposition: the data that support the findings of this study are available at https://figshare com/articles/other_people_s_gaze_encoded_as_implied_motion_in_the_human_brain/12184848/1 .     data deposition: the data that support the findings of this study are available at https://figshare","","The authors declare no competing interest.",TRUE,"This work was supported by the Princeton Neuroscience Institute Innovation Fund. A.G. was supported by the Wenner–Gren Foundation, the Swedish Society of Medicine, and the Foundation Blanceflor. We thank Sam Nastase for valuable input regarding the multivoxel pattern analysis.",TRUE,"",FALSE
"308",32460760,124,2020,0,FALSE,"",FALSE,"","","Competing interests The authors declare that they have no competing interests.",TRUE,"Funding Open access funding provided by Karolinska Institutet.",TRUE,"",FALSE
"309",32493516,104,2020,1,NA,NA,NA,NA,NA,"Declaration of interest M.H. declares grant funding from the National Institute of Health Research (NIHR), Medical Research Council, and Economic and Social Research Council; he is Principal Investigator on RADAR-CNS, a precompetitive public–private consortium funded by the Innovative Medicines Initiative, which includes contributions from European Federation of Pharmaceutical Industries and Association members, Janssen, UCB, MSD, Biogen and Lundbeck. M.H. and E.B. are NIHR Senior Investigators. R.C.O'C. reports grants from the NIHR, Medical Research Foundation, Scottish Government, NHS Health Scotland/Public Health Scotland, and Samaritans; he is co-chair of the Academic Advisory Group to the Scottish Government's National Suicide Prevention Leadership Group, and a member of the National Institute of Health and Care Excellence's guideline development group for the new NICE self-harm guidelines. E.A.H. reports grants from The Lupina Foundation, The OAK Foundation, the Swedish Research Council, outside the submitted work; she reports serving on the board of trustees of the charity MQ: Transforming Mental Health (UK) and as chair of the research committee, receiving no remuneration for these roles; she receives occasional consultancy fees from Statens beredning för medicinsk och social utvärdering (SBU, the Swedish agency for health technology assessment and assessment of social services), Sweden.",TRUE,"",FALSE,"",FALSE
"310",32494810,109,2020,1,FALSE,"",FALSE,"","","We thank Predrag Petrovic for comments on an earlier version, Rute Sequiera, Alexandros Kastrinogiannis, and Tess Collins for help during the data collection, and Amy Walsh for help with editing the manuscript.  Conflict of Interest : None declared.",TRUE,"Funding The Knut and Alice Wallenberg Foundation (KAW 2014.0237), a European Research Council Starting grant (284366; Emotional Learning in Social Interaction project), and a Consolidator grant (2018–00877) from Swedish Research Foundation (VR). The Netherlands Organization for Scientific Research (NWO Veni) grant (016.195.246 to R.M.V.).",TRUE,"",FALSE
"311",32499260,118,2020,0,FALSE,"",FALSE,"","","Competing interests: Drs ES and LWH are scientific consultants at the Scandinavian College of Naprapathic Manual Medicine and members of their Scientific Board.",TRUE,"Funding:  The study was funded by AFA- Insurance Grant No 170 095. The funder had no involvement in any of the steps of the manuscript preparation.",TRUE,"",FALSE
"312",32513881,117,2020,1,TRUE,"supplement",FALSE,"prison staff were in close contact with the researchers throughout the recruitment phase 10 1136/bmjopen-2019-034834 supp1 supplementary data 10 1136/bmjopen-2019-034834 supp2 supplementary data the focs programme aims to support positive parenting for a child's healthy development.","","Competing interests: None declared.",TRUE,"Funding:  This work was supported by the Solstickan Foundation and the Sven Jerring Foundation.",TRUE,"Trial registration number NCT04101799; Pre-results.",TRUE
"313",32556379,82,2021,0,FALSE,"",FALSE,"","","Conflict of interest EAH reports grants from The Lupina Foundation, grants from The Oak Foundation, during the conduct of the study; and EAH reports serving on the Editorial Advisory Board of the Lancet Psychiatry, and is an Associate Editor of Behaviour Research and Therapy. EAH reports serving on the board of the charity MQ: Transforming Mental Health (UK) and is on the board of overseers for the charity Children and War Foundation (Norway). EAH receives book royalties from Oxford University Press and occasional fees from clinical workshops and conference keynotes, outside the submitted work. All remaining authors declare no competing interests.",TRUE,"Open access funding provided by Karolinska Institute. This study was financially supported by the Swedish Research Council (Grant No: 2017-01032). EH receives support from the Oak Foundation and the Lupina Foundation.",TRUE,"",FALSE
"314",32564071,102,2020,0,FALSE,"",FALSE,"","","",FALSE,"",FALSE,"",FALSE
"315",32764745,112,2020,0,FALSE,"",TRUE,"","code to reproduce the figures is available at [ https://github com/kozleo/stable_dynamics ].;     code to reproduce the figures is available at [ https://github com/kozleo/stable_dynamics ].;     code to reproduce the figures is available at [ https://github com/kozleo/stable_dynamics ].","The authors have declared that no competing interests exist.",TRUE,"This work was supported by NIMH R37MH087027, The MIT Picower Institute Innovation Fund, ONR MURI N00014-16-1-2832, and Swedish Research Council Starting Grant 2018-04197. The funders had no role in study design, data collection and analysis, decision to publish, or preparation of the manuscript.",TRUE,"",FALSE
"316",32810869,92,2021,1,FALSE,"",FALSE,"","","Conflict of Interest:  No conflict of interest to declare.",TRUE,"Funding This work was supported by the Knut and Alice Wallenberg Foundation (KAW 2018.0152 to J.N.L.) and the Swedish Research Council (2017-02325 to J.N.L.).",TRUE,"",FALSE
"317",32873895,57,2021,0,FALSE,"",FALSE,"","","Conflict of interest The authors declare that they have no conflict of interest.",TRUE,"Funding JL is supported by Stress Research Institute, Stockholm University and Swedish Research Council, and was supported by Alexander von Humboldt-Stiftung (Humboldt fellowship for postdoctoral researchers, 1156790). ML is supported by Stockholm Stress Center, Swedish Research Council, Heumanska Stiftelsen/Swedish Brain Foundation, Swedish Society for Asthma and Allergy Research, and Swedish Heart-Lung Foundation. SB is supported by the Deutsche Forschungsgemeinschaft (DFG, German Research Foundation) – Project-ID 422744262 – TRR 289 (subproject A11), and BE 5173/3-1. MS is supported by the Deutsche Forschungsgemeinschaft (DFG, German Research Foundation) – Project-ID 422744262 – TRR 289 (subproject A10) and Project-ID 316803389 – SFB 1280 (subproject A18). HE is supported by the Deutsche Forschungsgemeinschaft (DFG, German Research Foundation) – Project-ID 422744262 – TRR 289 (subproject A10) and Project-ID 316803389 – SFB 1280 (subproject A12).",TRUE,"",FALSE
"318",32898146,108,2020,1,TRUE,"general-purpose repository, data availability statement",FALSE,"plos publication stage vor-update-to-uncorrected-proof publication update 2020-09-18 data availability all code and data are available from osf repository: https://osf io/8vwjy/ .;     data availability all code and data are available from osf repository: https://osf io/8vwjy/ .     data availability all code and data are available from osf","","The authors have declared that no competing interests exist.",TRUE,"This research was supported by the European Research Council (Independent Starting Grant 284366; Emotional Learning in Social Interaction), the Knut and Alice Wallenberg Foundation (KAW 2014.0237) and Consolidator Grant (2018-00877) from the Swedish Research Council to AO and by the Swedish Research Council (2016-06793) to PP. The funders had no role in study design, data collection and analysis, decision to publish, or preparation of the manuscript.",TRUE,"",FALSE
"319",32924086,43,2021,0,TRUE,"supplement",FALSE,"table 3 . raw data","","Conflict of interest On behalf of all authors, the corresponding author states that there is no conflict of interest.",TRUE,"Funding Open access funding provided by Uppsala University. This work was supported by Stockholm County Council and by grant from the Söderström–Königska Foundation (SLS-312941).",TRUE,"Parent management training (PMT) programmes and child cognitive behavioural therapy are recommended approaches for treatment of oppositional defiant disorder in children, and combining these may be effective. However, little is known regarding the economic efficiency of this additive effect. A within-trial cost-effectiveness analysis was carried out in Sweden including 120 children aged 8–12 who screened positive for disruptive behaviour disorders, within a psychiatric care setting, and their parents. They were randomly assigned to either the Swedish group-based PMT Comet, or to an enhanced version, where an additional child component was provided, the Coping Power Programme (CPP). Child behaviour problems as well as healthcare and educational resource use were measured at baseline, post-test and at two-year follow-up. A net benefit regression framework was used to estimate differences in costs and health outcomes between the two intervention arms during the two-year period. Comet with CPP cost on average 820 EURO more per family than Comet only. At the 2-year follow-up, there were 37% recovered cases of ODD in Comet with CPP, in comparison to 26% in the Comet only arm. At a willingness-to-pay of approximately 62,300 EURO per recovered case of ODD, Comet with CPP yielded positive net benefits, in comparison to Comet only. Offering children the CPP simultaneously as their parents receive PMT, in comparison to only providing PMT, yields clinically relevant gains. Despite the relatively small cost for CPP, investment in combining PMT and CPP should be guided by resource prioritisation. Trial registration number: ISRCTN10834473, date of registration: 23/12/2015",TRUE
"320",32962741,106,2020,1,FALSE,"",FALSE,"","","Competing interests The authors declare that they have no competing interests.",TRUE,"Funding This research was supported by the Knut and Alice Wallenberg Foundation (KAW 2014.0237), an independent starting grant (284366; Emotional Learning in Social Interaction project) from the European Research Council, and a consolidator grant (2018–00877) from Swedish Research Foundation (VR) to Andreas Olsson.",TRUE,"",FALSE
"321",32964334,39,2021,0,FALSE,"",FALSE,"","","Conflict of interest MJ, SV and ES are the developers of the BiP Anxiety treatment protocol. BL is a Shareholder in DahliaQomit AB. DM-C received personal fees from UpToDate and Elsevier; grants from NIMH, Vetenskapsradet, Jane and Dan Olsson Foundation, Hjarnfonden and NIHR UK. All other authors have declared no competing or potential conflict of interest.",TRUE,"Funding Open access funding provided by Karolinska Institute. The Swedish Research Council for Health, Working Life and Welfare (Forte 2014–4052) and Stockholm County Council (HNSV 14099) funded this trial.",TRUE,"Participants with a principal diagnosis of separation anxiety disorder, generalised anxiety disorder, specific phobia, social anxiety disorder or panic disorder were recruited through newspaper advertisements and referrals from the child- and adolescent mental health service (CAMHS) or primary care centres in Sweden. The study inclusion- and exclusion criteria are listed in Supplementary Table 1. Caregivers provided written consent and children provided verbal assent prior to participating in the study. The study protocol was approved by the Stockholm Regional Ethical Review Board (reference numbers 2014/1885-31 and 2015/316-31/1) and the trial was registered at ClinicalTrials.gov (number NCT02350257).",TRUE
"322",32979230,76,2021,1,FALSE,"",FALSE,"","","",FALSE,"Funding This study was not funded by any institution. The study was conducted in accordance with Declaration of Helsinki. Online informed consent was obtained from all individual participants included in the study. Ghaderi, A. & Parling, T. authored the self‐help book “Lev med din kropp” that was used in the present studies.",TRUE,"",FALSE
"323",33042933,107,2020,0,FALSE,"",FALSE,"","","Conflict of Interest The authors declare that the research was conducted in the absence of any commercial or financial relationships that could be construed as a potential conflict of interest.",TRUE,"Funding.  The studies were partly funded (payment for the equipment and analyses of the cytokines) from Nordforsk, Nordic Program on Health and Welfare (74809).",TRUE,"",FALSE
"324",33043561,103,2020,0,FALSE,"",FALSE,"","","",FALSE,"The LANE study was supported by grants from AFA Insurance (project nr 150284), which was otherwise not involved.",TRUE,"",FALSE
"325",33046817,101,2020,0,TRUE,"general-purpose repository, data availability statement",TRUE,"data availability data from psychophysiological recordings are stored in an osf repository and are available at https://osf io/d3wxn [note: this is a view only link for review osf project will be made public upon publication].     data availability data from psychophysiological recordings are stored in an osf","code replicating analyses reported here is available at https://github com/mslw/vic-fear-learning-physio .","Competing interests The authors declare no competing interests.",TRUE,"We would like to thank Artur Marchewka for his valuable comments regarding the study design and the interpretation of results. Data collection and analysis were sponsored by National Science Centre grant 2015/19/B/HS6/02209. Ewelina Knapska was supported by European Research Council Starting Grant (H 415148).",TRUE,"",FALSE
"326",33054774,100,2020,0,FALSE,"",FALSE,"","","Competing interests CM Bulik reports: Shire (grant recipient, Scientific Advisory Board member); Idorsia (consultant) Pearson (author, royalty recipient). Other authors report no competing interests.",TRUE,"Funding This work is funded by the Swedish Research Council (VR Dnr: 538–2013-8864) as well as the German Research Society (DFG: EH 367/7–1). The funding body was not involved in the design of the study, data collection, analysis and interpretation of data, as well as in writing the manuscript. Open Access funding enabled and organized by Projekt DEAL.",TRUE,"Stage 1 Initial screen: The Stage 1 review determines preliminary eligibility (females only, aged between 18 and 50 Fig. ). Twins who appear to be MZ and discordant for AN based on diagnostic information obtained via participation in the STR [] are sent an invitation to participate in Stage 1. Danish twins are identified by selecting a cohort of all MZ female twins, age 18–50 from the DTR (n = 1617 pairs, where both twins are alive per 1st of October 2018) or via social media or contacts with healthcare providers. Via the Danish National Patient Register [] and Psychiatric Central Research Register [], this cohort will be matched for the diagnosis of AN and contact information obtained via the Civil Registration System. After giving informed consent, each twin pair is genotyped to verify monozygosity (for details see Supplementary Material 1.1, Additional file ). In addition to the saliva kits for the monozygosity screening, participants are also provided with a link to a validated diagnostic online questionnaire, ED100K [] which captures lifetime DSM-5 eating disorder diagnoses. This is a second stage of verifying that affected twins did indeed have AN and that co-twins and control twins are unaffected.
Fig. 3Inclusion (↓)/Exclusion (→) procedures for recruitment. Pre-screening begins at Stage 1. Individuals are screened with the ED100K online questionnaire [] for lifetime eating disorder symptoms as well as genetic testing. Participants are excluded if screening reveals them to be dizygotic or if the unaffected co-twin is discovered to be affected. Screening at Stage 2 is more intensive and includes telephone interviews by trained interviewers conducting the Eating Disorder Examination [EDE []], Mini-International-Neuropsychiatric-Interview [MINI, []], and the Eating Disorders section of the Structured Clinical Interview for DSM-5 [SCID-5 []]. If all criteria fulfilled and participants remain interested in participating, they are invited to participate in the 30 h study protocol",TRUE
"327",33087746,99,2020,0,TRUE,"general-purpose repository",FALSE,"code for stimulus presentation is available at https://doi org/10 5281/zenodo 235595 .;     behavioural data including emg heart rate and pupil diameter are available within the zenodo repository: https://doi org/10 5281/zenodo 3821968 .","","Competing interests The authors declare no competing interests.",TRUE,"Funding Open Access funding provided by Karolinska Institute. This work was funded by Stockholm Stress Center, Riksbankens Jubileumsfond, Karolinska Institutet, Stockholm County Council, Isabella and Henrik Berg and the Heumanska stiftelsen/Hjärnfonden, Fredrik and Ingrid Thuring’s Foundation.",TRUE,"The present study reports findings from one of the experimental tasks from the Stockholm Sleepy Brain Study 1. The Stockholm Sleepy Brain Study 1 was an experiment on the effects of partial sleep deprivation (3 h of sleep) in younger (20–30 years) and older (65–75 years) healthy participants, in a randomised cross-over design. We have previously published a detailed description of study procedures and the resulting dataset. Other reports based on the same dataset describe resting state connectivity, polysomnography data, empathy, emotional regulation and morphometry. The study was approved by the Regional Ethics Review board of Stockholm (2012/1565-32 and 2012/1870-32) and all participants gave written informed consent. Experiments were performed in accordance with the Declaration of Helsinki and applicable local regulations. The project was preregistered at clinicaltrials.gov (https://clinicaltrials.gov/ct2/show/NCT02000076), registration number NCT02000076, registered on 03/12/2013.",TRUE
"328",33196894,91,2021,1,FALSE,"",FALSE,"","","Data Sharing and Declaration The individual-level data that support the findings of this study are available from the European Union Agency for Fundamental Rights, but restrictions apply to the availability of these data. Conflict of Interest The authors declare that they have no conflict of interest.",TRUE,"Funding The current study was financially supported by grants from the Swedish Research Council [grant number 2016-01707] and the Swedish National Research School for Healthcare Sciences [grant number 2015-0133]. The funding agencies were not involved in study design, data collection, analyses, data interpretation, or the reporting of the study. Open access funding provided by Karolinska Institute.",TRUE,"",FALSE
"329",33212440,90,2021,1,TRUE,"general-purpose repository",FALSE,"full details of the trial design procedures outcome measures analysis plans and stata code are publicly available at the open science framework ( https://osf io/exh47/ ).;     the primary outcome was the generalised anxiety disorder 7-items scale (gad-7) [ ] adapted to assess worry related to the covid-19 pandemic (available at https://osf io/exh47/ ).;     secondary outcomes were the covid-19-adapted version of the work and social adjustment scale (wsas) [ ] a brief measure of functional impairment (available at https://osf io/exh47/ ) the madrs-s a widely used measure of depressive symptoms [ ] the intolerance of uncertainty scale short version (ius-12) which measures intolerance of uncertainty (a key aspect of worry) [ ] and the insomnia severity index (isi) as a measure of insomnia [ ].","","Conflict of Interest Statement Dr. Andersson, Dr. Wahlund, Dr. Mataix-Cols, Dr. De Schipper, and Ms Olofsdotter Lauri received financial support from VINNOVA for the submitted work; Dr. Ljótsson reports personal fees from Pear Therapeutics Inc., outside the submitted work; In addition, Dr. Ljótsson has copyright to an IBS self-help manual with royalties paid from Pear Therapeutics Inc.; Dr. Mataix-Cols reports personal fees from Elsevier and UpToDate Inc., outside the submitted work. The authors have no additional conflicts of interest to declare.",TRUE,"Funding Sources The funding organisation (VINNOVA) had no role in the conception of the study design, or in the collection, analysis or interpretation of the data, in the writing of the report, or in the decision to submit the paper.",TRUE,"Full details of the trial design, procedures, outcome measures, analysis plans, and Stata code are publicly available at the Open Science Framework (https://osf.io/exh47/). The trial was conducted at a single site (Karolinska Institutet, Stockholm, Sweden) with nationwide inclusion of participants. Participants were randomised to the online intervention or to a waiting list (1:1 ratio). The waiting list controls for the passage of time and spontaneous worry fluctuations, which is crucial given the rapidly changing landscape of COVID-19. The primary endpoint was set to week 3 (post-treatment). Participants randomised to the waiting list were crossed over to the intervention after the controlled study period (week 3). Uncontrolled follow-ups were conducted 1 month post-treatment for the treatment group. The national ethical review board in Sweden approved the study (registration ID: 2020-01719), and the trial was registered on ClinicalTrials.gov on April 10, 2020, before participant enrolment (registration ID: NCT04341922). The study is reported in accordance to the CONSORT statement for nonpharmacological treatment trials. Methods: 670 adults from the Swedish general population reporting daily uncontrollable worry about CO­VID-19 and its possible consequences (e.g., illness, death, the economy, one's family) were randomised (1:1 ratio) to a 3-week self-guided, online cognitive behavioural intervention targeting dysfunctional COVID-19 worry and associated symptoms, or a waiting list of equal duration. The primary outcome measure was a COVID-19 adapted version of the Generalised Anxiety Disorder 7-item scale administered at baseline and weeks 1–3 (primary endpoint). Follow-up assessments were conducted 1 month after treatment completion. The trial was registered on ClinicalTrials.gov (NCT04341922) before inclusion of the first participant.",TRUE
