"","pmid","X","publication_year","last_author","is_open_data","open_data_category","is_open_code","open_data_statements","open_code_statements","coi_text","is_coi_pred","fund_text","is_fund_pred","register_text","is_register_pred"
"222",30094173,200,2018,0,FALSE,"",FALSE,"","","Competing interests None.",TRUE,"Funding SA and M Hornberger are supported by Alzheimer's Research UK. CRB is supported by a Medical Research Council Clinician Scientist Fellowship (MR/K010395/1). M Husain is supported by the Wellcome Trust and NIHR Oxford Biomedical Research Centre.",TRUE,"",FALSE
"223",30097711,164,2019,0,FALSE,"",FALSE,"","","Conflict of interest All authors declare that he/she has no conflict of interest.",TRUE,"Funding Julie L. Ji was supported by Cambridge Australia Scholarships in collaboration with the Cambridge Commonwealth, European and International Trust, and the Forrest Research Foundation. Emily A. Holmes was supported by the Medical Research Council (United Kingdom) intramural programme MC-A060-5PR50, and the Karolinska Institutet. Colin MacLeod was supported by Australian Research Council Grant DP170104533 and FL170100167. Fionnuala C. Murphy was supported by the UK Medical Research Council intramural programme SUAG/003.",TRUE,"",FALSE
"224",30099390,198,2018,0,FALSE,"",FALSE,"","","Competing interests: None declared.",TRUE,"Funding:  This work was funded by the Public Health Agency of Sweden (Folkhälsomyndigheten), grant number: 03136-2015.",TRUE,"Trial registration number ISRCTN38702517; Pre-results.",TRUE
"225",30129665,178,2019,0,FALSE,"",FALSE,"","","",FALSE,"This research was supported by the UK Medical Research Council (SUAG/003). This research could not have been completed without the generous time and support offered by our many participants, along with the family members of participants with ABI. We are extremely grateful to them all and thank Sharon Davies for her assistance with patient recruitment and to Peter Watson for statistical guidance.",TRUE,"",FALSE
"226",30131057,197,2018,0,FALSE,"",FALSE,"","","Competing interests Author PB is part owner of a company that develops and distributes electronic life style interventions to the health care sector and private companies. All remaining authors declare that they have no competing interests.",TRUE,"Funding This study was supported by grant nr 20140487 to author AHB provided by the Stockholm County Council (PPG project for patient-focused research and development in Primary Care, Psychiatry and Geriatrics), supporting authors KK and EP during the study implementation; as well as Swedish Research Council grant nr K2012-61X-22132-01-6 to author AHB, supporting authors KK, EP and KS during manuscript preparation; and Swedish Research Council grant nr K2012-61P-22131-01-6, supporting author AHB’s salary throughout the project. Author EH was supported by funding from Karolinska Institutet and Stockholm County Council. All other authors were supported by their employers for their work throughout the project. The funding organizations had no role in the conception of the study, in the analyses of the data, in the writing of the manuscript, nor in the decision to submit it for publication.",TRUE,"",FALSE
"227",30185575,196,2018,1,FALSE,"",FALSE,"","","Competing interests: None declared.",TRUE,"Funding:  This study is funded by the Swedish Research Council (K2013-61P-22168) and the regional agreement on medical training and clinical research (ALF) between Stockholm County Council and Karolinska Institutet.",TRUE,"Trial registration number NCT02541968; Pre-results.",TRUE
"228",30207392,177,2019,0,FALSE,"",FALSE,"","","The manuscript was supported by grants from the Swedish Research Council, grant 2014‐10082 (C.H., J.B., B.L., E.H‐L., and H.S.), the SISMA and the American Foundation for Suicide Prevention
(B.M.D'O). J.B., A.O., B.M.D'O., J.J., H.S., M.C., and C.H. report no potential conflicts of interest. B.L. and E.H‐L. are shareholders of DahliaQomit Inc. a company specializing in online psychiatric symptom assessment. P.L. has served as a speaker for Medice. Conflict of interest statement: See acknowledgements for disclosure.",TRUE,"The manuscript was supported by grants from the Swedish Research Council, grant 2014‐10082 (C.H., J.B., B.L., E.H‐L., and H.S.), the SISMA and the American Foundation for Suicide Prevention
(B.M.D'O). J.B., A.O., B.M.D'O., J.J., H.S., M.C., and C.H. report no potential conflicts of interest. B.L. and E.H‐L. are shareholders of DahliaQomit Inc. a company specializing in online psychiatric symptom assessment. P.L. has served as a speaker for Medice.",TRUE,"",FALSE
"229",30293686,172,2019,0,FALSE,"",FALSE,"","","Conflict of interest ALZ, AH, ELJ, KP, LI and RMV declare that they have no conflicts of interest. EAH is an Honorary Professor of Clinical Psychology at the University of Oxford, Department of Psychiatry, holds an honorary contract at the Medical Research Council (MRC) Cognition and Brain Sciences Unit, University of Cambridge, UK and serves on the Board of the Charity “MQ; transforming mental health”; she receives no remuneration for these roles.",TRUE,"Funding This work was supported by a Wellcome Trust Strategic Award [098461/Z/12/Z]; the European Union's Horizon 2020 Research and Innovation Programme under the Marie Skłodowska-Curie agreement [No 705641]; the Medical Research Council Cognition and Brain Sciences Unit, University of Cambridge [SUAG/013/RG91365]; the Cambridge International Scholarship Scheme [the Cambridge Commonwealth Trust and the Cambridge Overseas Trust]; the Swedish Research Council [2017-00957]; the Lupina Foundation; and the Swiss National Science Foundation [SNF; grant 32003B_172982]. Funding to pay the Open Access publication charges for this article was provided by the Medical Research Council Cognition and Brain Sciences Unit, University of Cambridge [SUAG/013/RG91365].",TRUE,"",FALSE
"230",30305103,193,2018,1,FALSE,"",FALSE,"","","Competing interests JB, HS, KLG, MTT, JJ, and CH report no competing interests. EHL and BL are shareholders of DahliaQomit, a company specializing in online psychiatric symptom assessment.",TRUE,"Funding This project was supported by the National Self Injury Project in Sweden, grant 2014–1008 from the Swedish Research Council, grant MAW 2014.0021 from the Markus and Amelia Wallenberg Foundation, Fredrik och Ingrid Thurings Stifelse, L. J., the Sven Jerring Foundation, the Kempe-Carlgrenska Foundation, and Bror Gadelius minnesfond. None of the funding organizations had any influence on study design; in the collection, analysis, or interpretation of the data; or in the preparation, review, or approval of the manuscript.",TRUE,"Trial registration ClinicalTrials.gov (NCT02697019). Registered 2 March 2016",TRUE
"231",30321038,154,2019,0,TRUE,"general-purpose repository",FALSE,"the code to run the experiment (matlab psychtoolbox) data-analysis code (matlab r) and the behavioral data are available online (see https://osf io/a47xe/ ).","","",FALSE,"",FALSE,"",FALSE
"232",30474734,171,2019,0,FALSE,"",FALSE,"","","Conflict of interest No potential conflict of interest was reported by the authors.",TRUE,"Funding No external funding was obtained for this meta-analysis.",TRUE,"",FALSE
"233",30477463,192,2018,1,FALSE,"",FALSE,"","","Competing interests The authors declare that they have no competing interests.",TRUE,"Funding This research did not receive any specific grant from funding agencies in the public, commercial, or not-for-profit sectors.",TRUE,"Trial registration This study has been approved 19/12 2011, by the regional review board in Stockholm (Dnr 2011/1593–31/5).",TRUE
"234",30496342,176,2019,0,FALSE,"",FALSE,"","","The authors would like to acknowledge the patients who generously gave their time during a period of significant personal difficulty, as well as the clinical staff at Harborview Medical Center and Seattle Children’s Hospital. We would like to thank previous members of the Ojemann research group, who developed some of the experimental infrastructure that contributed to this project, and Martti Mercurio, who developed the digital touch probes. We also acknowledge our funding sources: NIH NS065186, NIH NS079200, NSF EEC-1028725, NSF DGE-1256082, NSF IIS-1514790, 2K12HD001097, The Swedish Research Council, Torsten Söderbergs Stiftelse, the Wenner-Gren Foundation (AG), the Swedish Society of Medicine (AG), and the Foundation Blanceflor (AG). None of the work in this project or the manuscript represents the opinions of the NIH or NSF.  Conflict of Interest : None declared.",TRUE,"The authors would like to acknowledge the patients who generously gave their time during a period of significant personal difficulty, as well as the clinical staff at Harborview Medical Center and Seattle Children’s Hospital. We would like to thank previous members of the Ojemann research group, who developed some of the experimental infrastructure that contributed to this project, and Martti Mercurio, who developed the digital touch probes. We also acknowledge our funding sources: NIH NS065186, NIH NS079200, NSF EEC-1028725, NSF DGE-1256082, NSF IIS-1514790, 2K12HD001097, The Swedish Research Council, Torsten Söderbergs Stiftelse, the Wenner-Gren Foundation (AG), the Swedish Society of Medicine (AG), and the Foundation Blanceflor (AG). None of the work in this project or the manuscript represents the opinions of the NIH or NSF. Conflict of Interest: None declared.",TRUE,"",FALSE
"235",30558161,190,2018,0,FALSE,"",FALSE,"","","Conflicts of Interest The authors declare no conflict of interest.",TRUE,"Funding This research received no external funding.",TRUE,"",FALSE
"236",30559179,189,2019,0,FALSE,"",FALSE,"","","The authors declare no conflict of interest.",TRUE,"This work was supported by the Princeton Neuroscience Institute Innovation Fund. A.G. was supported by the Wenner-Gren Foundation, the Swedish Society of Medicine, and The Foundation Blanceflor.",TRUE,"",FALSE
"237",30585371,157,2019,1,FALSE,"",FALSE,"","","CONFLICT OF INTEREST This study was supported by a grant from Riksbankens Jubileumsfond (P13‐0649:1). None of the authors has any relevant conflict of interest to declare.",TRUE,"This study was supported by a grant from Riksbankens Jubileumsfond (P13‐0649:1). None of the authors has any relevant conflict of interest to declare.",TRUE,"",FALSE
"238",30609172,156,2019,0,FALSE,"",FALSE,"","","CONFLICT OF INTEREST No author has reported a conflict of interest.",TRUE,"Funding information",TRUE,"",FALSE
"239",30647044,188,2019,0,FALSE,"",FALSE,"","","Competing interests: None declared.",TRUE,"Funding:  This study was funded through the regional agreement on medical training and clinical research (ALF) between the Stockholm County Council and Karolinska Institutet, the Swedish Research Council (grant No: K2013-61X-22168-01-3) and the Swedish Society of Medicine (Söderströmska Königska sjukhemmet, grant no: SLS3B4451).",TRUE,"Trial registration number NCT02010619.",TRUE
"240",30651382,183,2019,0,FALSE,"",FALSE,"","","Disclosure The authors report no disclosures relevant to the manuscript. Go to Neurology.org/N for full disclosures.",TRUE,"Go to Neurology.org/N for full disclosures. Funding information and disclosures deemed relevant by the authors, if any, are provided at the end of the article. Study funding: W.X. received grants from the Swedish Research Council (2017-00981), the National Natural Science Foundation of China (81771519), Demensfonden, the Konung Gustaf V:s och Drottning Victorias Frimurare Foundation (2016–2017), and Alzeimerfonden (2017–2018). C.S.D. is supported in part by KID-funding from Karolinska Institutet and SWEAH. D.B. and K.A. received grants from the NIH (R01AG17917 and UH2NS100599). This project is part of CoSTREAM (costream.eu) and received funding from the European Union's Horizon 2020 research and innovation program under grant agreement 667375.",TRUE,"",FALSE
"241",30676039,146,2019,0,TRUE,"general-purpose repository",FALSE,"all data and materials have been made publicly available via the open science framework and can be accessed at https://osf io/gz3vb/ .;     all data and materials have been made publicly available via the open science framework and can be accessed at https://osf io/gz3vb/ .","","",FALSE,"",FALSE,"",FALSE
"242",30679293,187,2019,0,FALSE,"",FALSE,"","","Competing interests: None declared.",TRUE,"Funding:  This study was supported by grants from the Jan and Dan Olsson Foundation (4-1559/2013), the Swedish Research Council (521-2013-2846), the Kempe-Carlgren Foundation, the Ruth and Richard Julin Foundation (2012Juli0048), the Majblomman Foundation, the Ishizu Matsumurais Donation, the Bengt Ihre Foundation (SLS-331861), the Bengt Ihre Research Fellowship in Gastroenterology, the Swedish Society of Medicine (SLS331681, SLS-410501), the Stockholm County Council (ALF) and the Swedish Research Council for Health, Working Life and Welfare (2014-4052). Financial support was also provided through the regional agreement on medical training and clinical research between Stockholm County Council and Karolinska Institutet (20130129).",TRUE,"Trial registration number NCT02306369; Results.",TRUE
"243",30742884,160,2019,1,TRUE,"general-purpose repository, supplement",FALSE,"data and code are available at: https://osf io/wbdmj/ .  appendix a supplementary data the following are the supplementary data to this article: supplementary fig 1 supplementary fig 2 supplementary data 1 appendix a supplementary data to this article can be found online at https://doi org/10 1016/j bbi 2019 02 006 .","","Conflict of interest statement The authors declare not conflict of interest.",TRUE,"Funding This work was supported by a grant from Stockholm Stress Center. The funder was not involved in the study design, in data collection, analysis and interpretation of data, in the writing of the report, nor in the decision to submit the article for publication.",TRUE,"",FALSE
"244",30760585,174,2019,1,TRUE,"general-purpose repository",FALSE,"data are available at https://osf io/xfe72/ .","","The authors declare no conflict of interest.",TRUE,"We thank Marc Guitart-Masip, Ida Selbing, and Philip Pärnamets for comments on an earlier version of the manuscript and Tove Hensler, Diana Diaz Del Castillo, and Erik Enström for help with data collection. This research was supported by Knut and Alice Wallenberg Foundation Grant KAW 2014.0237; Riksbankens Jubileumsfond Grant P11-1017; and Independent Starting Grant 284366 (Emotional Learning in Social Interaction project) from the European Research Council (to A.O.). B.L. was supported by Forte Grant COFAS2: 2014-2785 FOIP; A.G. was supported by Swedish Research Council Grant 2015-00312; and P.N.T. was supported by Swiss National Science Foundation Grants 100014_165884 and 100019_176016.",TRUE,"",FALSE
"245",30772854,182,2019,0,FALSE,"",FALSE,"","","Competing interests: LFC and DM-C receive royalties for contributing articles to UpToDate, Wolters Kluwer Health.",TRUE,"Funding:  This work was supported by the Stockholm County Council (PPG project 2016-0108). Dr Murphy was supported by the NIHR Great Ormond Street Hospital Biomedical Research Centre.",TRUE,"Trial registration number NCT02864589; Pre-results.",TRUE
"246",30797989,175,2019,1,TRUE,"general-purpose repository",FALSE,"data and materials are available via the open science framework and can be accessed at osf io/x238k or are otherwise available from the authors on reasonable request (with the exception of questionnaire measures subject to third-party copyright or potentially identifying participant information).","","Conflicts of interest Emily Holmes is Associate Editor at Behaviour Research and Therapy. The authors declare no further competing interests.",TRUE,"This work was funded by a Marie Sklodowska-Curie individual Fellowship (Grant number 655026) from the European Union to F.R. F.R. is supported by a Sofja Kovalevskaja Award from the Alexander von Humboldt Foundation and the German Federal Ministry for Education and Research. F.C.M. and T.M. are funded by the UK Medical Research Council intramural programme SUAG/003. This research was supported by the Medical Research Council (SUAI/022 RG92024). The authors would like to thank Adam Potter for helping with data collection.",TRUE,"",FALSE
"247",30814485,181,2019,1,FALSE,"",FALSE,"","","Conflict of interest G.M.G. holds shares in P1vital and has served as consultant, advisor or CME speaker for advisor or CME speaker for Allergan, Angelini, Compass pathways, MSD, Lundbeck (/Otsuka or /Takeda), Medscape, Minerva neuroscience, P1Vital, Pfizer, Sage, Servier, Shire and Sun pharma. E.A.H. reports serving on the board of MQ: Transforming Mental Health, on the Editorial Advisory Board of The Lancet Psychiatry, and as Associate Editor of Behaviour Research and Therapy. EAH receives book royalties from Oxford University Press and occasional fees from clinical workshops and conference keynotes, outside the submitted work. K.P., D.H., R.G.F. and K.W. declare no conflicts of interest.",TRUE,"We would like to thank Daniel Lunn for statistical support on this study, Rachel Sharman for second scoring of EEG data and Ella James for second scoring of the intrusion diaries. These experiments were supported by a Wellcome Trust Strategic Award [098461/Z/12/Z] to the Sleep and Circadian Neuroscience Institute (SCNi) at the University of Oxford and the National Institute for Health Research (NIHR) Oxford Biomedical Research Centre based at Oxford University Hospitals NHS Trust, Oxford University (A92181 to E.A.H., G.M.G., K.W. and R.G.F.). The views expressed are those of the author(s) and not necessarily those of the NHS, the NIHR, or the Department of Health. Additionally, G.M.G. is a NIHR Emeritus Senior Investigator, E.A.H. has received funding from The Wellcome Trust, the Lupina Foundation and the Swedish Research Council (2017-00957), and D.H. was supported by a Rubicon grant (grant no.: 446-13-010) from the Netherlands Organization for Scientific Research.",TRUE,"",FALSE
"248",30816244,180,2019,1,FALSE,"",FALSE,"","","Competing Interests The authors declare no competing interests.",TRUE,"This study was funded by the Swedish Research Council, FORTE (Swedish Research Council for Health, Working Life and Welfare), and The Swedish Foundation for Humanities and Social Sciences.",TRUE,"",FALSE
"249",30818385,179,2019,0,TRUE,"supplement",FALSE,"see s1 data for raw data.;     in light of the absence of a robust tactile expectation effect in the present data we propose that tactile expectations alone should not be considered sufficient to induce a sense of ownership over artificial limbs until further more convincing evidence is presented s1 data questionnaire threat-evoked scr and continuous skin conductance and subjective ratings data (xlsx) click here for additional data file s1 fig see table 1 for statements.  xlsx) click here for additional data file s1","","Competing Interests: The authors have declared that no competing interests exist.",TRUE,"This research was made possible by funding from the Swedish Research Council, Torsten Söderbergs Stiftelse, Göran Gustafssons Stiftelse, the Wenner-Gren Foundation (AG), the Swedish Society for Medicine (AG) and the Foundation Blanceflor (AG). The funders had no role in study design, data collection and analysis, decision to publish, or preparation of the manuscript.",TRUE,"",FALSE
"250",30840633,173,2019,1,TRUE,"general-purpose repository, data availability statement",FALSE,"data availability data underlying the study is available on the dryad repository (doi: 10 5061/dryad sh00j9s ).;     data availability data underlying the study is available on the dryad repository (doi: 10 5061/dryad sh00j9s ).     data availability data underlying the study is available on the dryad","","Competing Interests: The authors have declared that no competing interests exist.",TRUE,"This work was supported by grants Centre for Allergy Research (2008-10, https://ki.se/en/research/the-centre-for-allergy-research-cfa) at Karolinska Institutet, Hedlund Foundation (Pla 1380/09 and 1184/10, http://www.hedlundsstiftelse.se/), the Swedish Heart Lung Foundation (2013-15, https://www.hjart-lungfonden.se/), Swedish Asthma and Allergy Association (2007055, https://astmaoallergiforbundet.se/) and the Swedish Council for Working Life and Social Research (2009-01758, https://forte.se/). The funders had no role in study design, data collection and analysis, decision to publish, or preparation of the manuscript.",TRUE,"",FALSE
"251",30975106,170,2019,0,FALSE,"",FALSE,"","","Competing interests The authors declare that they have no competing interests.",TRUE,"Funding This study was funded by Skandia Insurance, the Martin Rind Foundation, and the Sven Jerring Foundation.",TRUE,"Trial registration  ISRCTN, ISRCTN39690370, retrospectively registered March 1, 2013, http://www.isrctn.com/ISRCTN39690370.",TRUE
"252",30999690,169,2019,1,FALSE,"",FALSE,"","","Conflicts of Interest The authors declare no conflicts of interest.",TRUE,"Funding This research was funded by the Swedish Research Council for Environment, Agricultural Sciences and Spatial Planning (FORMAS) project number: 942-2015-610. Johan N Lundström was funded by grants from the Knut and Alice Wallenberg Foundation (KAW 2018.0152) and the Swedish Research Council (2014-01346).",TRUE,"",FALSE
"253",31009465,168,2019,1,FALSE,"",FALSE,"","","Competing Interests: The authors have declared that no competing interests exist.",TRUE,"This research was supported by grants awarded to Agneta Herlitz by the Swedish Research Council (grant no. 521-2007-3020, 421-2009-2255, and 721-2014-2241) and the Swedish Research Council for Health, Working Life and Welfare (FORTE) (grant no. 2010-0705).",TRUE,"",FALSE
"254",31021150,145,2019,1,FALSE,"",FALSE,"","","",FALSE,"",FALSE,"",FALSE
"255",31053793,167,2019,0,TRUE,"general-purpose repository, data availability statement",FALSE,"the modified images from the imagenet database training set are available at the open science framework https://osf io/t7ej9/?;     raw data and the details of the bayesian analysis are available at https://osf io/m4fy6/?     data availability neither of the experiments reported in this article was formally preregistered. the modified images from the imagenet database training set are available at the open science framework","","Competing Interests The authors declare no competing interests.",TRUE,"We would like to thank Tim Masquelier and Jean-Michel Hupé for useful discussions, and Céline Cappe for lending us her equipment. This work has received funding from the European Research Council under the European Union’s Seventh Framework Programme (FP/2007–2013)/ERC Grant Agreement n.323711 (M4 project).",TRUE,"",FALSE
"256",31072238,144,2019,0,FALSE,"",FALSE,"","","Disclosure statement No potential conflict of interest was reported by the authors.",TRUE,"This work was supported by the Stockholm County Council (ALF) under Grant 20180266 and the National School in Caring Sciences at Karolinska Institutet (NFV);Kommunfullmäktige, Stockholms Stad [20180266];National School in Caring Science (NFV) - Karolinska Institutet;",TRUE,"",FALSE
"257",31072317,166,2019,0,FALSE,"",FALSE,"","","Competing interests The authors declare that they have no competing interests.",TRUE,"Funding This project is funded by ZonMw (The Netherlands Organisation for Health Research and Development; info@zonmw.nl; project number 537001003). The publication costs will be covered from this grant. The funding body has no influence on the design study or writing the current manuscript and will not participate in data collection, analysis or interpretation of the data.",TRUE,"Trial registration The study has been registered on October 17th, 2018 at the Netherlands Trial Register, part of the Dutch Cochrane Centre (NTR7563).",TRUE
