"","pmid","X","publication_year","last_author","is_open_data","open_data_category","is_open_code","open_data_statements","open_code_statements","coi_text","is_coi_pred","fund_text","is_fund_pred","register_text","is_register_pred"
"1",20034617,414,2010,0,FALSE,"",FALSE,"","","Drs. Browning, Holmes, and Murphy report no biomedical financial interests or potential conflicts of interest. Professor Goodwin has received compensation from AstraZeneca, Bristol-Myers Squibb, Eisai, Eli Lilly, Lundbeck, P1Vital, Sanofi-Aventis, Servier, and Wyeth and holds shares in P1Vital. Dr. Harmer is on the advisory board of P1Vital and has received compensation from GlaxoSmithKline, Servier, Merck, Sharp and Dohme, and Lundbeck. She also holds shares in P1Vital.",TRUE,"MB is supported by a Clinical Training Fellowship from the Wellcome Trust (WT081672MA), which funded this study. EAH is supported by a Royal Society Dorothy Hodgkin Fellowship and the Economic and Social Research Council (RES-061-23-0030). CJH is supported by the Medical Research Council (G0301005).",TRUE,"",FALSE
"2",20532199,413,2010,0,FALSE,"",FALSE,"","","The authors have declared that no competing interests exist.",TRUE,"This work was partly supported by grants from the Swedish Science Council (Vetenskapsrådet, VR-621-2004-3807), VINNOVA (Swedish Governmental Agency for Innovation Systems), the Swedish Foundation for Strategic Research (through the Stockholm Brain Institute), and from the European Union (FACETS project, FP6-2004-IST-FETPI-015879). AC acknowledges support from the Instituto de Salud Carlos III, Spain, and from the Researcher Stabilization Program of the Health Department of the Generalitat de Catalunya. The funders had no role in study design, data collection and analysis, decision to publish, or preparation of the manuscript.",TRUE,"",FALSE
"3",20598127,412,2010,0,FALSE,"",FALSE,"","","Competing interests The authors declare that they have no competing interests.",TRUE,"The Stockholm County Council sponsored this study. We thank Monica Hellberg and Erik Hedman for substantially contributing to the realisation of the study.",TRUE,"Trial registration ClinicalTrials.gov NCT00845260",TRUE
"4",21085661,411,2010,0,FALSE,"",FALSE,"","","Competing Interests: The authors have declared that no competing interests exist.",TRUE,"Funding:  Emily A. Holmes has received fellowship funding from the Royal Society and the Wellcome Trust. Ella L. James was supported by a Wellcome Trust Vacation Scholarship and a Colt Foundation Fellowship. The funders had no role in study design, data collection and analysis, decision to publish, or preparation of the manuscript.",TRUE,"",FALSE
"5",21127102,410,2010,0,FALSE,"",FALSE,"","","Competing interests: None.",TRUE,"Funding: [ pi ]The study was funded by a grant from the  Wales Office of Research and Development for Health and Social Care, part of the Wales Assembly Government  (reference: ReF06/2/ 220). All researchers involved in this study were independent of the funding organisation. The funding organisation had no involvement in the conduct or reporting of this research.",TRUE,"",FALSE
"6",21156746,408,2010,1,TRUE,"data availability statement",FALSE,"data sharing: statistical code and dataset of ratings are available from the corresponding author at john axelsson@ki se . cite this as: bmj 2010;341:c6614","","Competing interests: All authors have completed the Unified Competing Interest form at www.icmje.org/coi_disclosure.pdf (available on request from the corresponding author) and declare: no support from any company for the submitted work; no financial relationships with any companies that might have an interest in the submitted work in the previous 3 years; no other relationships or activities that could appear to have influenced the submitted work.",TRUE,"We thank B Karshikoff for support with data acquisition and M Ingvar for comments on an earlier draft of the manuscript, both without compensation and working at the Department for Clinical Neuroscience, Karolinska Institutet, Sweden.Contributors: JA designed the data collection, supervised and monitored data collection, wrote the statistical analysis plan, carried out the statistical analyses, obtained funding, drafted and revised the manuscript, and is guarantor. TS designed and carried out the data collection, cleaned the data, drafted, revised the manuscript, and had final approval of the manuscript. JA and TS contributed equally to the work. MI wrote the statistical analysis plan, carried out the statistical analyses, drafted the manuscript, and critically revised the manuscript. EJWVS provided statistical advice, advised on data handling, and critically revised the manuscript. AO provided advice on the methods and critically revised the manuscript. ML provided administrative support, drafted the manuscript, and critically revised the manuscript. All authors approved the final version of the manuscript.Funding: This study was funded by the Swedish Society for Medical Research, Rut and Arvid Wolff’s Memory Fund, and the Osher Center for Integrative Medicine.Competing interests: All authors have completed the Unified Competing Interest form at www.icmje.org/coi_disclosure.pdf (available on request from the corresponding author) and declare: no support from any company for the submitted work; no financial relationships with any companies that might have an interest in the submitted work in the previous 3 years; no other relationships or activities that could appear to have influenced the submitted work.Ethical approval: This study was approved by the Karolinska Institutet’s ethical committee. Participants were compensated for their participation.Participant consent: Participant’s consent obtained.Data sharing: Statistical code and dataset of ratings are available from the corresponding author at john.axelsson@ki.se. Funding: This study was funded by the Swedish Society for Medical Research, Rut and Arvid Wolff’s Memory Fund, and the Osher Center for Integrative Medicine. Competing interests: All authors have completed the Unified Competing Interest form at www.icmje.org/coi_disclosure.pdf (available on request from the corresponding author) and declare: no support from any company for the submitted work; no financial relationships with any companies that might have an interest in the submitted work in the previous 3 years; no other relationships or activities that could appear to have influenced the submitted work.",TRUE,"",FALSE
"7",21170381,409,2010,1,FALSE,"",FALSE,"","","Competing Interests: The authors declare and confirm that the commercial funder AFA insurance did not alter their adherence to any of the PLoS ONE policies on sharing data and materials.",TRUE,"Funding:  The LANE study has been made possible by funding from the insurance company AFA (Arbetsmarknadens Försäkringsaktiebolag). DH is supported by a grant from FAS (Swedish Council for Working Life and Social Research) Centre for Research on Hearing Problems in Working Life and Tysta Skolan. The funders had no role in study design, data collection and analysis, decision to publish, or preparation of the manuscript.",TRUE,"",FALSE
"8",21208425,405,2011,0,FALSE,"",FALSE,"","","Competing interests The authors declare that they have no competing interests.",TRUE,"This project was made possible by the support of the Canadian Institutes of Health Research (CIHR) Knowledge Translation Synthesis Program (KRS 86255). JES holds CIHR Postdoctoral and Bisby Fellowships; at the time of this research she held Killam, CIHR and Alberta Heritage Foundation for Medical Research (AHFMR) doctoral fellowships. CAE holds a CIHR Canada Research Chair in Knowledge Translation. PG holds a grant from AFA Insurance and LW is supported by the Center for Care Sciences at Karolinska Institutet. All authors participated in designing the study, securing funding for the project, and developing the search strategy. JES undertook the article selection; data extraction and quality assessment; and drafted the manuscript. CAE, PG, and LW provided valuable advice throughout the study. All authors provided critical commentary on the manuscript and approved the final version.",TRUE,"",FALSE
"9",21383847,404,2011,0,FALSE,"",FALSE,"","","Competing Interests: The authors have declared that no competing interests exist.",TRUE,"Funding:  This study was funded by the European Research Council (erc.europa.eu), The Swedish Foundation for Strategic Research ( www.stratresearch.se/en ), The Human Frontier Science Program ( www.hfsp.org ), and Stockholm Brain Institute ( www.stockholmbrain.se ). The funders had no role in study design, data collection and analysis, decision to publish, or preparation of the manuscript.",TRUE,"",FALSE
"10",21416451,395,2011,1,FALSE,"",FALSE,"","","",FALSE,"This research was funded by Microsoft Research Cambridge, a Wellcome Trust Clinical Fellowship awarded to Emily A. Holmes (088217), and the UK Medical Research Council under project code A060_0022 (Philip Barnard). We would like to thank Leah Campbell for help with designing the tasks.",TRUE,"",FALSE
"11",21439049,402,2011,0,FALSE,"",FALSE,"","","Competing interests The authors declare that they have no competing interests.",TRUE,"Acknowledgements and funding We want to thank all the families and teachers in the schools who participate in this intervention. This study is funded by the Public Health Fund, Stockholm County Council, grant number HSN 0908-0786 and the Signhild Engkvist Foundation.",TRUE,"Trial registration ISRCTN: ISRCTN32750699",TRUE
"12",21448267,403,2011,0,FALSE,"",FALSE,"","","Competing Interests: The authors have declared that no competing interests exist.",TRUE,"Funding:  This study was supported by The Swedish Cancer Society, The Vardal Institute, The
County Council of Ostergotland, The University of Linköping, Cancer and
Traffic Injury Fund and The Vardal Foundation for Health Care Sciences and
Allergy Research. Mats Lekander and Martin Ingvar are members of Stockholm Brain
Institute funded by Vinnova and The Swedish Strategic Research Foundation. The
funders had no role in study design, data collection and analysis, decision to
publish, or preparation of the manuscript.",TRUE,"Trial Registration ClinicalTrials.gov NCT00621660",TRUE
"13",21473754,400,2011,0,FALSE,"",FALSE,"","","Competing interests The authors declare that they have no competing interests.",TRUE,"",FALSE,"",FALSE
"14",21483704,401,2011,0,FALSE,"",FALSE,"","","Competing Interests: The authors have declared that no competing interests exist.",TRUE,"Funding:  This study was supported by research grants from Stockholm County Council (Nils
Lindefors) and the Bror Gadelius Fund (Erik Hedman). The main funding
organization (Stockholm County Council) is a public institution and neither of
the funding organizations had any role in the design and conduct of the study;
in the collection, management, and analysis of the data; or in the preparation,
review and approval of the manuscript.",TRUE,"Trial Registration ClinicalTrials.gov NCT00564967
",TRUE
"15",21633503,407,2011,0,FALSE,"",FALSE,"","","Competing Interests: The authors have declared that no competing interests exist.",TRUE,"Funding:  This work was supported financially by the European Research Council, the Swedish Foundation for Strategic Research, the Human Frontier Science Programme, the James S. McDonnell Foundation, and the Söderbergska Stiftelsen. The funders had no role in study design, data collection and analysis, decision to publish, or preparation of the manuscript.",TRUE,"",FALSE
"16",21668746,398,2011,1,FALSE,"",FALSE,"","","",FALSE,"CB is supported by a Lord Florey Scholarship of the Berrow Foundation and an Eugenio Litta Scholarship, KV is funded by an NIHR Academic Clinical Lecturer Award, and EH is supported by a Wellcome Trust Clinical Fellowship (WT088217) and a grant from the Lupina Foundation.",TRUE,"",FALSE
"17",21676694,399,2011,0,FALSE,"",FALSE,"","","None declared",TRUE,"The funding organization (Stockholm County Council) is a public institution that had no role in the design and conduct of the study; in the collection, management, and analysis of the data; or in the preparation, review and approval of the manuscript.",TRUE,"Trial registration  Clinicaltrials.gov NCT01145690; http://clinicaltrials.gov/ct2/show/NCT01145690 (Archived by WebCite at http://www.webcitation.org/5ygRxDLfK)",TRUE
"18",21783339,390,2011,1,FALSE,"",FALSE,"","","Conflict of interest None.",TRUE,"Emily Holmes was supported by the Wellcome trust (WT088217) and The Lupina Foundation.",TRUE,"",FALSE
"19",21794144,397,2011,0,FALSE,"",FALSE,"","","Competing interests The authors declare that they have no competing interests.",TRUE,"This project was made possible by the support of the Canadian Institutes of Health Research (CIHR) Knowledge Translation Synthesis Program (KRS 86255). JES is supported by CIHR postdoctoral and Bisby fellowships. CAE holds a CIHR Canada Research Chair in Knowledge Translation. HMO holds Alberta Heritage Foundation for Medical Research (AHFMR) and KT Canada (CIHR) doctoral scholarships. PG holds a grant from AFA Insurance, and LW is supported by the Center for Care Sciences at Karolinska Institutet. We would like to thank Dagmara Chojecki, MLIS for her support in finalizing the search strategy.",TRUE,"",FALSE
"20",21798515,394,2011,0,FALSE,"",FALSE,"","","",FALSE,"Funding for this study was provided by a Wellcome Trust Intermediate Clinical Fellowship awarded to Emily A. Holmes (088217). Christopher G. Fairburn is a Wellcome Trust Principal Research Fellow (046386). The Wellcome Trust had no further role in study design; in the collection, analysis and interpretation of data; in the writing of the report; and in the decision to submit the paper for publication. SMS mood monitoring was supported by a National Institute for Health Research-NIHR Programme Grant for Applied Research: RP-PG-0108-10087 (Guy M. Goodwin and John R. Geddes PIs) and Oxford Health NHS Foundation Trust.",TRUE,"",FALSE
"21",21812991,396,2011,0,FALSE,"",FALSE,"","","Competing interests The authors declare that they have no competing interests.",TRUE,"The Swedish Research Council, the Söderströmska-Königska Foundation and Stockholm County Council for funding the study. Anna-Clara Hellstadius, Sara Steneby and Jan Bergström for proofreading the treatment manual. Diana Radu Djurfeldt, Carl Granfors, Karin Hyland, Johan Larsson, Sergej Andréewitch and Simon Cervenka for diagnostic assessments. Monica Hellberg and Yvonne Sedlenieks for administrative assistance.",TRUE,"Trial Registration ClinicalTrials.gov: NCT01348529",TRUE
"22",21832988,389,2011,0,FALSE,"",FALSE,"","","GMG has held grants from Bailly Thomas, Sanofi-Aventis, and Servier, received honoraria for speaking or chairing educational meetings from AstraZeneca, Bristol-Meyers Squibb, Eisai, Lundbeck, Sanofi-Aventis, and Servier, and advised AstraZeneca, Bristol-Meyers Squibb, Boehringer Ingelheim, Cephalon, Hoffman-Laroche, Janssen-Cilag, Lilly, Lundbeck, P1vital, Roche, Sanofi-aventis, Shering Plough, Servier, and Wyeth. He holds shares in P1vital and acted as expert witness for Lilly and Servier. CJH is on the advisory board of P1vital Ltd and holds shares in this company. She is a company director and holds shares in Oxford Psychologists Ltd. The other authors declare no conflict of interest.",TRUE,"This research was supported by a Wellcome Trust Fellowship to Dr Browning (081672). Dr Holmes was supported by a Wellcome Trust Clinical Fellowship (088217). Finally, some of the caveats in interpreting the results of this study should be acknowledged. We have suggested that our results may have clinical implications; however, extrapolating these laboratory results to the clinic requires two assumptions. First, it assumes that the degree of affective bias change induced by a treatment is a reasonable proxy for the clinical efficacy of that treatment, and second, it assumes that the cognitive effects of the interventions demonstrated in this study of healthy volunteers are an accurate reflection of their effects in clinical populations. Support for these assumptions is provided by previous work, which has demonstrated that the initial effects of antidepressants on affective bias predict later clinical response () and by the similarity between the effects of the treatments on affective biases in non-clinical and clinical populations (, ). Furthermore, the finding that the cognitive effects of citalopram predicted its protective effect during the mood induction task supports a link between affective bias and subjective mood. However, a more direct test of these assumptions would obviously be provided by replicating the current findings in a clinical sample. A second caveat is that the stability and persistence of any cognitive bias training is likely to be influenced both by the reliability of the measures of cognitive bias (see  and ) and by the variability in the induced bias itself (; ). As our study was designed to test the immediate impact of interventions on cognitive functioning and mood reactivity, we did not assess the degree to which the induced biases persisted and remained stable after completion of the treatment. Future studies may be able to address this limitation by retesting the effects of the treatments at later time points. Third, we monitored compliance with the pharmacological aspect of treatment using participants' self-report only. It would have been reassuring also to have access to serum citalopram levels to objectively confirm compliance. Fourth, we did not collect detailed information on participants' family history of depression. Given the previous finding that this factor is associated with more pronounced negative mood effects of tryptophan depletion (), it would be interesting to investigate whether it also mediated the protective effects of citalopram found during the mood induction task. Finally, it should also be acknowledged that the sample sizes used in the study were relatively modest. Thus, although the study was able to identify significant interactions between the two treatments, other treatment effects may not have been detected because of insufficient power.",TRUE,"",FALSE
"23",21849316,381,2012,1,FALSE,"",FALSE,"","","",FALSE,"E.A.H. was supported by a Wellcome Trust Clinical Fellowship (Ref: 088217). SMS mood monitoring was supported by a National Institute for Health Research-NIHR Programme Grant for Applied Research: RP-PG-0108-10087 (G.M.G. and J.R.G. PIs) and Oxford Health NHS Foundation Trust. We would like to thank the Royal Society who provided the intellectual environment for the development of this interdisciplinary project.",TRUE,"",FALSE
"24",21992655,393,2011,0,FALSE,"",FALSE,"","","Competing interests The authors declare that they have no competing interests.",TRUE,"Acknowledgements and funding This study was funded by the Stockholm City Council, the Stockholm Centre for Psychiatry Research, Linköping University, the Söderström-Königska Foundation, and the Bror Gadelius Foundation. The main funding organization (Stockholm County Council) is a public institution and none of the funding organizations had any role in the design and conduct of the study; in the collection, management, and analysis of the data; or in the preparation, review, and approval of the manuscript.",TRUE,"Trial Registration ClinicalTrials.gov: NCT00844961",TRUE
"25",22032936,388,2011,1,FALSE,"",FALSE,"","","",FALSE,"This research was supported by a Wellcome Trust Intermediate Clinical Fellowship to Emily Holmes (WT088217) and support from the Lupina Foundation.",TRUE,"",FALSE
"26",22064977,377,2012,0,FALSE,"",FALSE,"","","Conflict of interest None.",TRUE,"We are grateful to head radiographer Stuart Wilson for his assistance in the smooth running of the project. We would like to thank SBR for his enthusiastic participation and generous offering of his time. This research was funded by the Royal Society (University Research Fellowship to HB), a Wellcome Trust Clinical Fellowship (WT088217 to EH) and the NIHR Biomedical Research Centre, Oxford (CK).",TRUE,"",FALSE
"27",22085478,392,2011,1,FALSE,"",FALSE,"","","GMG has received grants from Sanofi-aventis and Servier in the past, and honoraria from various pharmaceutical companies. EAH has received funding from a Wellcome Trust Clinical Fellowship (WT088217); and grants from the Lupina Foundation, Royal Society, Medical Research Council, and the Economic and Social Research Council in the UK. SAH and CD have no conflicts of interest to report.",TRUE,"This research was funded by Oxfordshire and Buckinghamshire Mental Health Trust support to SAH, and a Wellcome Trust Clinical Fellowship awarded to EAH. GMG has received grants from Sanofi-aventis and Servier in the past, and honoraria from various pharmaceutical companies. EAH has received funding from a Wellcome Trust Clinical Fellowship (WT088217); and grants from the Lupina Foundation, Royal Society, Medical Research Council, and the Economic and Social Research Council in the UK. SAH and CD have no conflicts of interest to report.",TRUE,"",FALSE
"28",22087265,406,2011,0,FALSE,"",FALSE,"","","Competing Interests: The authors have declared that no competing interests exist.",TRUE,"Funding:  Financial support was provided through the regional agreement on medical training and clinical research (ALF) between Stockholm County Council and Karolinska Institutet, grants from the Swedish Research Council (SIMSAM grant number 80748301), Centre for Allergy Research and the Strategic Research Program in Epidemiology at Karolinska Institutet. Fang Fang was partially supported by a postdoctoral fellowship from Hjärnfonden. Caroline Olgart Höglund was supported by the Karolinska Institutet and the Swedish Heart Lung Foundation. The funders had no role in study design, data collection and analysis, decision to publish, or preparation of the manuscript.",TRUE,"",FALSE
"29",22098673,391,2011,1,FALSE,"",FALSE,"","","Competing interests The authors declare that they have no competing interests.",TRUE,"",FALSE,"",FALSE
"30",22104657,376,2012,1,FALSE,"",FALSE,"","","",FALSE,"Emily A. Holmes is supported by a Wellcome Trust Clinical Fellowship (WT088217). This research was also supported by a grant from the Economic and Social Research Council (RES-061-23-0030), a John Fell OUP Grant (PRAC/JF), and funding from the National Institute of Health Research (NIHR) awarded to Emily A. Holmes. We would like to thank Anna Chilvers and Louise Acker for assistance in data collection. We would also like to thank the providers of the film clips used in these studies, including LyleBailie International, Kino International and the British Film Institute National Archives.",TRUE,"",FALSE
"31",22264332,382,2012,0,FALSE,"",FALSE,"","","Competing interests Financial disclosure: Susanna Jernelöv is the author of the commercially available self-help book used in this study. We are aware of no other competing interests.",TRUE,"Preparation of this article was supported by Osher Center for Integrative Medicine, the Stockholm Stress Center, Centre for Allergy Research, the Karolinska Institutet, AFA Sickness Insurance Research Fund, the regional agreement on medical training and clinical research (ALF) between Stockholm County Council and Karolinska Institutet, and the Bror Gadelius memory foundation. The funders had no role in study design, data collection and analysis, decision to publish, or preparation of the manuscript.",TRUE,"Trial Registration ClinicalTrials.gov: NCT01105052",TRUE
"32",22348650,374,2012,0,FALSE,"",FALSE,"","","Declaration of Interest None.",TRUE,"Financial support was provided through the regional agreement on medical training and clinical research (ALF) between Stockholm County Council and Karolinska Institutet. Thanks to the Swedish Research Council and the Swedish Society of Medicine (Söderström Königska sjukhemmet) for funding the study and Maja Ågren and Elin Elveling for diagnostic assessments and treatment assistance.",TRUE,"The study protocol was approved by the regional ethics review board in Stockholm, Sweden. The trial was registered at Clinicaltrials.gov, registration ID: NCT01347099.",TRUE
